"from","to","author","subject_l2","subject_l1","time_window","article_count","weight","first_year","last_year","titles"
"A_14","S_4","Bridgman, E. C.","Anthropology","Anthropology and Social Customs","1858-1867",1,0.5,1859,1859,"Sketches of the Miau - tsze"
"A_3","S_4","Macgowan, D. J.","Anthropology","Anthropology and Social Customs","1858-1867",1,0.5,1858,1858,"Contribution to the ethnology of Eastern Asia"
"A_14","S_3","Bridgman, E. C.","Ethnology","Anthropology and Social Customs","1858-1867",1,0.5,1859,1859,"Sketches of the Miau - tsze"
"A_3","S_3","Macgowan, D. J.","Ethnology","Anthropology and Social Customs","1858-1867",1,0.5,1858,1858,"Contribution to the ethnology of Eastern Asia"
"A_34","S_25","Butcher, C. H.","Manners and customs","Anthropology and Social Customs","1858-1867",1,1,1864,1864,"Notes on the funeral rites performed at the obsequies of Takee"
"A_40","S_25","Hollingworth, H. G.","Manners and customs","Anthropology and Social Customs","1858-1867",1,1,1866,1866,"Short sketch of the Chinese game of chess, Seang - kh'e, A *"
"A_23","S_25","Jamieson, R. A.","Manners and customs","Anthropology and Social Customs","1858-1867",1,0.5,1864,1864,"Remarks upon exhibiting a To - lo Pall to the Society"
"A_1","S_17","Edkins, J.","Mythology","Anthropology and Social Customs","1858-1867",1,1,1859,1859,"A Sketch of the Tauist Mythology in its modern form"
"A_48","S_17","Watters, T.","Mythology","Anthropology and Social Customs","1858-1867",1,0.5,1867,1867,"Chinese notions about pigeons and doves"
"A_32","S_24","Bastion","Archaeology","Arts and Archaeology","1858-1867",1,1,1865,1865,"The Remains of Ancient Kambodia"
"A_38","S_28","Keer, J. G.","Architecture","Arts and Archaeology","1858-1867",1,0.5,1866,1866,"Description of the Great Examination Hall at Canton"
"A_7","S_8","Syle, E. W.","Music","Arts and Archaeology","1858-1867",1,1,1859,1859,"On the Musical Notation of the Chinese"
"A_2","S_2","Wylie, A.","Numismatics","Arts and Archaeology","1858-1867",1,1,1858,1858,"Coins of the Ta - ts'ing or present dynasty of China *"
"A_33","S_16","Jarvie, R.","Commerce","Economy, Trade, and Technology","1858-1867",1,0.333333333333333,1864,1864,"Respecting China grass"
"A_13","S_16","Robertson, D. B.","Commerce","Economy, Trade, and Technology","1858-1867",1,0.333333333333333,1859,1859,"Cotton in China"
"A_47","S_16","Simon, G. E.","Commerce","Economy, Trade, and Technology","1858-1867",1,0.333333333333333,1867,1867,"Carte agricole generale de l'Empire Chinois. Texte preface, legende et repertoire"
"A_37","S_16","Williamson, A.","Commerce","Economy, Trade, and Technology","1858-1867",2,0.5,1867,1867,"Notes on the north of China, its productions and communications | Notes on the productions, chiefly mineral of Shantung"
"A_33","S_15","Jarvie, R.","Industries","Economy, Trade, and Technology","1858-1867",1,0.333333333333333,1864,1864,"Respecting China grass"
"A_13","S_15","Robertson, D. B.","Industries","Economy, Trade, and Technology","1858-1867",1,0.333333333333333,1859,1859,"Cotton in China"
"A_47","S_15","Simon, G. E.","Industries","Economy, Trade, and Technology","1858-1867",1,0.333333333333333,1867,1867,"Carte agricole generale de l'Empire Chinois. Texte preface, legende et repertoire"
"A_37","S_15","Williamson, A.","Industries","Economy, Trade, and Technology","1858-1867",2,0.5,1867,1867,"Notes on the north of China, its productions and communications | Notes on the productions, chiefly mineral of Shantung"
"A_37","S_31","Williamson, A.","Telecommunication","Economy, Trade, and Technology","1858-1867",1,0.25,1867,1867,"Notes on the north of China, its productions and communications"
"A_38","S_11","Keer, J. G.","Education","Education","1858-1867",1,0.5,1866,1866,"Description of the Great Examination Hall at Canton"
"A_9","S_11","Pompe van Meedervoort, J. L. C.","Education","Education","1858-1867",1,1,1859,1859,"On the Study of the Natural Sciences in Japan"
"A_41","S_6","Bickmore, A. S.","Travel","Geography and Travel","1858-1867",1,0.5,1867,1867,"Sketch of a journey from Canton to Hankow through the Provinces of Kwangtung, Kwangsi, and Hunan, with geological notes *"
"A_22","S_6","Canny, J. M.","Travel","Geography and Travel","1858-1867",1,1,1864,1864,"The Sea-board of Russian Manchuria"
"A_21","S_6","Dickson, W.","Travel","Geography and Travel","1858-1867",1,1,1864,1864,"Narrative of an overland trip, through Hunan, from Canton to Hankow"
"A_1","S_6","Edkins, J.","Travel","Geography and Travel","1858-1867",1,1,1865,1865,"A Visit to the Agricultural Mongols"
"A_5","S_6","Foote, A. H.","Travel","Geography and Travel","1858-1867",1,1,1858,1858,"Visit to Simoda and Hakodadi in Japan"
"A_19","S_6","Lindau, R.","Travel","Geography and Travel","1858-1867",1,1,1864,1864,"Notes on the city of Yedo, the capital of Japan *"
"A_36","S_6","Martin, W. A. P.","Travel","Geography and Travel","1858-1867",1,1,1865,1865,"Account of an overland journey from Peking to Shanghai, February and March 1866"
"A_12","S_6","Swinhoe, R.","Travel","Geography and Travel","1858-1867",1,1,1859,1859,"Narrative of a visit to the island of Formosa"
"A_25","S_6","Wilds, E.","Travel","Geography and Travel","1858-1867",1,1,1864,1864,"Report on the appearance of the Rugged Islands"
"A_11","S_6","Williams, S. W.","Travel","Geography and Travel","1858-1867",1,1,1859,1859,"Lecture on Japan"
"A_37","S_6","Williamson, A.","Travel","Geography and Travel","1858-1867",1,1,1866,1866,"Notes of a Journey from Peking to Chefoo via Grand Canal , Yen -chow -foo, &c"
"A_2","S_6","Wylie, A.","Travel","Geography and Travel","1858-1867",1,1,1864,1864,"Overland journey from St. Petersburg to Pekin, The"
"A_45","S_32","Mayers, W. F.","Chronology, Historical","History and Chronology","1858-1867",1,1,1867,1867,"Chinese chronological tables"
"A_11","S_30","Williams, S. W.","History","History and Chronology","1858-1867",1,1,1866,1866,"Political intercourse between China and Lewchew"
"A_34","S_18","Butcher, C. H.","History, Modern (20th century)","History and Chronology","1858-1867",1,1,1866,1866,"Retrospect of events in the north of China, 1866"
"A_17","S_18","Editorial Committee","History, Modern (20th century)","History and Chronology","1858-1867",1,1,1860,1860,"Record of occurrences, 1860"
"A_23","S_18","Jamieson, R. A.","History, Modern (20th century)","History and Chronology","1858-1867",1,1,1864,1864,"Retrospect of events in the north of China, 1861-1864"
"A_29","S_18","Kingsmill, T. W.","History, Modern (20th century)","History and Chronology","1858-1867",2,2,1865,1867,"Retrospect of events in China and Japan | Retrospect of events in China and Japan, 1867"
"A_11","S_18","Williams, S. W.","History, Modern (20th century)","History and Chronology","1858-1867",1,1,1859,1859,"Narrative of the American Embassy to Peking"
"A_46","S_7","Forrest, R. J.","Language and languages","Literature and Language","1858-1867",1,0.333333333333333,1867,1867,"The Christianity of Hung Tsiu Tsuen ; a review of Taeping Books"
"A_27","S_7","Gamble, W.","Language and languages","Literature and Language","1858-1867",1,1,1864,1864,"Specimen of a new font of Chinese movable type belonging to the American Presbyterian Mission *"
"A_23","S_7","Jamieson, R. A.","Language and languages","Literature and Language","1858-1867",1,1,1864,1864,"The Hieroglyphic Character of the Chinese written Lan. 113"
"A_3","S_7","Macgowan, D. J.","Language and languages","Literature and Language","1858-1867",1,1,1859,1859,"Chinese bibliography"
"A_9","S_7","Pompe van Meedervoort, J. L. C.","Language and languages","Literature and Language","1858-1867",1,1,1860,1860,"Dissection of a Japanese criminal"
"A_46","S_33","Forrest, R. J.","Literature","Literature and Language","1858-1867",1,0.333333333333333,1867,1867,"The Christianity of Hung Tsiu Tsuen ; a review of Taeping Books"
"A_33","S_14","Jarvie, R.","Agriculture","Natural Sciences","1858-1867",1,0.333333333333333,1864,1864,"Respecting China grass"
"A_13","S_14","Robertson, D. B.","Agriculture","Natural Sciences","1858-1867",1,0.333333333333333,1859,1859,"Cotton in China"
"A_47","S_14","Simon, G. E.","Agriculture","Natural Sciences","1858-1867",1,0.333333333333333,1867,1867,"Carte agricole generale de l'Empire Chinois. Texte preface, legende et repertoire"
"A_37","S_14","Williamson, A.","Agriculture","Natural Sciences","1858-1867",2,0.5,1867,1867,"Notes on the north of China, its productions and communications | Notes on the productions, chiefly mineral of Shantung"
"A_2","S_29","Wylie, A.","Astronomy","Natural Sciences","1858-1867",2,2,1866,1867,"Notes on the opinions of the Chinese with regard to eclipses | Eclipses recorded in Chinese works"
"A_31","S_19","Collins, V. D.","Botany","Natural Sciences","1858-1867",1,1,1865,1865,"Sorgo, or Northern Chinese sugar cane"
"A_3","S_19","Macgowan, D. J.","Botany","Natural Sciences","1858-1867",1,0.25,1860,1860,"On the Cosmical Phenomena observed in the neighborhood of Shanghai , during the past thirteen centuries"
"A_28","S_26","Lamprey","Chemistry","Natural Sciences","1858-1867",1,1,1864,1864,"Remarks on the "" water we use "" in Shanghai"
"A_41","S_20","Bickmore, A. S.","Geology","Natural Sciences","1858-1867",1,0.5,1867,1867,"Sketch of a journey from Canton to Hankow through the Provinces of Kwangtung, Kwangsi, and Hunan, with geological notes *"
"A_1","S_20","Edkins, J.","Geology","Natural Sciences","1858-1867",1,1,1867,1867,"The Bituminous coal mines west of Peking"
"A_29","S_20","Kingsmill, T. W.","Geology","Natural Sciences","1858-1867",2,2,1865,1866,"A Sketch of the Geology of Quang -tung Province | Notes on some outlying coal-fields in the south-eastern provinces of China"
"A_28","S_20","Lamprey","Geology","Natural Sciences","1858-1867",1,1,1865,1865,"Notes on the geology of the Great Plain *"
"A_3","S_20","Macgowan, D. J.","Geology","Natural Sciences","1858-1867",1,0.25,1860,1860,"On the Cosmical Phenomena observed in the neighborhood of Shanghai , during the past thirteen centuries"
"A_16","S_20","Shock, W. H.","Geology","Natural Sciences","1858-1867",1,1,1860,1860,"Notes on the mineral resources of Japan, etc."
"A_37","S_20","Williamson, A.","Geology","Natural Sciences","1858-1867",1,0.25,1867,1867,"Notes on the productions, chiefly mineral of Shantung"
"A_1","S_10","Edkins, J.","Hydrology","Natural Sciences","1858-1867",1,1,1860,1860,"On the ancient mouths of Yangts<U+00EF> kiang"
"A_24","S_10","Edwards","Hydrology","Natural Sciences","1858-1867",1,1,1864,1864,"Extracts from a report on the present condition of the sea wall at the head of Hang - chow Bay"
"A_44","S_10","Ellias, N.","Hydrology","Natural Sciences","1858-1867",1,1,1867,1867,"Notes on a portion of the old bed of the Yellow River an the water supply of the Grand Canal"
"A_3","S_10","Macgowan, D. J.","Hydrology","Natural Sciences","1858-1867",1,0.25,1860,1860,"On the Cosmical Phenomena observed in the neighborhood of Shanghai , during the past thirteen centuries"
"A_49","S_10","The Hankow Times","Hydrology","Natural Sciences","1858-1867",1,1,1867,1867,"Flood in the Han River 1857 "" The Hankow Times """
"A_8","S_10","Ward, J.","Hydrology","Natural Sciences","1858-1867",1,1,1859,1859,"Sailing directions for the Yang - tsze Kiang, from Woosung to Hankow"
"A_20","S_22","Henderson, J.","Medicine","Natural Sciences","1858-1867",1,1,1864,1864,"Medicine and medical practice of the Chinese, The"
"A_18","S_5","Courtney, C. F. A.","Meteorology","Natural Sciences","1858-1867",1,1,1860,1860,"Temperature of Hakodadi"
"A_17","S_5","Editorial Committee","Meteorology","Natural Sciences","1858-1867",1,1,1860,1860,"Winds and weather at Chefoo"
"A_10","S_5","Fedorovitch, J.","Meteorology","Natural Sciences","1858-1867",1,1,1859,1859,"Thermometrical observations, taken during a passage from Nagasaki to Shanghai"
"A_20","S_5","Henderson, J.","Meteorology","Natural Sciences","1858-1867",1,1,1864,1864,"Notes on some of the physical causes which modify climate"
"A_26","S_5","Hollingworth and Piry","Meteorology","Natural Sciences","1858-1867",1,1,1864,1864,"Barometric and thermometric observations taken September 1864, with a view to determining the height of Lew Shan"
"A_3","S_5","Macgowan, D. J.","Meteorology","Natural Sciences","1858-1867",1,0.25,1860,1860,"On the Cosmical Phenomena observed in the neighborhood of Shanghai , during the past thirteen centuries"
"A_4","S_5","Nicolson, F. W.","Meteorology","Natural Sciences","1858-1867",1,1,1858,1858,"On Cyclones , or the Law of Storms"
"A_6","S_5","Shadwell, C. F. A.","Meteorology","Natural Sciences","1858-1867",2,2,1859,1860,"Memorandum on the present state of some of the magnetic elements in china and palces adjacent | Supplemental memorandum on the present state of the magnetic elements in China and places adjacent"
"A_39","S_12","McCartee, D. B.","Zoology","Natural Sciences","1858-1867",1,1,1866,1866,"On some Wild Silkworms of China"
"A_43","S_12","Pryer, W. B.","Zoology","Natural Sciences","1858-1867",1,1,1867,1867,"Entomology of Shanghai"
"A_12","S_12","Swinhoe, R.","Zoology","Natural Sciences","1858-1867",3,3,1859,1865,"Notes on some new species of birds found on the island of Formosa | The Small Chinese Lark | Birds and beasts of Formosa"
"A_48","S_12","Watters, T.","Zoology","Natural Sciences","1858-1867",1,0.5,1867,1867,"Chinese notions about pigeons and doves"
"A_3","S_13","Macgowan, D. J.","Law","Politics, Government, and Law","1858-1867",1,1,1859,1859,"On the Banishment of Criminals in China"
"A_35","S_13","Stronach, W. T.","Law","Politics, Government, and Law","1858-1867",1,1,1864,1864,"Traces of the Judicium dei, or ordeal in Chinese law"
"A_1","S_1","Edkins, J.","Buddhism","Religion and Philosophy","1858-1867",1,1,1858,1858,"A Buddhist Shastra , Translated from the Chinese"
"A_23","S_1","Jamieson, R. A.","Buddhism","Religion and Philosophy","1858-1867",1,0.5,1864,1864,"Remarks upon exhibiting a To - lo Pall to the Society"
"A_30","S_23","Brown, S. R.","Christianity","Religion and Philosophy","1858-1867",1,1,1865,1865,"Annals of the Western Ocean"
"A_46","S_23","Forrest, R. J.","Christianity","Religion and Philosophy","1858-1867",1,0.333333333333333,1867,1867,"The Christianity of Hung Tsiu Tsuen ; a review of Taeping Books"
"A_42","S_23","Gardener, C. T.","Christianity","Religion and Philosophy","1858-1867",1,1,1867,1867,"Trans. Of inscription on tablet at Hangkow recording the changing the T'ien Chu Tang (Roman Catholic Church) into the T'ien Hao Tung *"
"A_1","S_21","Edkins, J.","Confucianism","Religion and Philosophy","1858-1867",1,1,1860,1860,"A Sketch of the Life of Confucius"
"A_36","S_27","Martin, W. A. P.","Judaism","Religion and Philosophy","1858-1867",1,1,1864,1864,"Account of an overland journey from Peking to Shanghai, February and March 1865"
"A_1","S_9","Edkins, J.","Philosophy","Religion and Philosophy","1858-1867",1,1,1859,1859,"Notices of the character and writings of Meh tsi"
"A_15","S_9","John, G.","Philosophy","Religion and Philosophy","1858-1867",1,1,1860,1860,"The Ethics of the Chinese, with special reference to the doctrine of Human Nature and Sin"
"A_72","S_4","Bretschneider, E.","Anthropology","Anthropology and Social Customs","1868-1877",1,0.25,1876,1876,"Notices of the mediaeval geography and history of Central and Western Asia *"
"A_29","S_4","Kingsmill, T. W.","Anthropology","Anthropology and Social Customs","1868-1877",2,0.75,1876,1877,"Short notes on the identification of the Yue - ti and Kiang tribes of ancient Chinese history | The Borderlands of geology and history"
"A_3","S_4","Macgowan, D. J.","Anthropology","Anthropology and Social Customs","1868-1877",1,0.5,1869,1870,"Notes on the Chihkiang Miautsz"
"A_12","S_4","Swinhoe, R.","Anthropology","Anthropology and Social Customs","1868-1877",1,0.25,1871,1872,"The Aborigines of Hainan"
"A_68","S_4","Taintor, E. C.","Anthropology","Anthropology and Social Customs","1868-1877",1,0.5,1875,1875,"The Aborigines of Northern Formosa"
"A_72","S_3","Bretschneider, E.","Ethnology","Anthropology and Social Customs","1868-1877",1,0.25,1876,1876,"Notices of the mediaeval geography and history of Central and Western Asia *"
"A_29","S_3","Kingsmill, T. W.","Ethnology","Anthropology and Social Customs","1868-1877",2,0.75,1876,1877,"Short notes on the identification of the Yue - ti and Kiang tribes of ancient Chinese history | The Borderlands of geology and history"
"A_3","S_3","Macgowan, D. J.","Ethnology","Anthropology and Social Customs","1868-1877",1,0.5,1869,1870,"Notes on the Chihkiang Miautsz"
"A_12","S_3","Swinhoe, R.","Ethnology","Anthropology and Social Customs","1868-1877",1,0.25,1871,1872,"The Aborigines of Hainan"
"A_68","S_3","Taintor, E. C.","Ethnology","Anthropology and Social Customs","1868-1877",1,0.5,1875,1875,"The Aborigines of Northern Formosa"
"A_54","S_25","Himly, K.","Manners and customs","Anthropology and Social Customs","1868-1877",1,1,1869,1870,"The Chinese game of chess as compared with that practised by Western nations"
"A_57","S_25","North China Daily News","Manners and customs","Anthropology and Social Customs","1868-1877",1,1,1869,1870,"Example of Chinese torture"
"A_58","S_25","Stent, G. C.","Manners and customs","Anthropology and Social Customs","1868-1877",1,1,1877,1877,"Chinese eunuchs"
"A_48","S_17","Watters, T.","Mythology","Anthropology and Social Customs","1868-1877",1,1,1874,1874,"Chinese fox - myths"
"A_66","S_24","Bushell, S. W.","Archaeology","Arts and Archaeology","1868-1877",1,1,1874,1874,"Stone drums of the Chou Dynasty, The *"
"A_59","S_24","Thompson, J.","Archaeology","Arts and Archaeology","1868-1877",1,1,1871,1872,"On the Antiquities of Cambodia"
"A_65","S_8","Dennys, N. B.","Music","Arts and Archaeology","1868-1877",1,1,1874,1874,"Short notes on Chinese instruments of music *"
"A_50","S_8","Jenkins, B.","Music","Arts and Archaeology","1868-1877",1,1,1868,1868,"Notions of the ancient Chinese respecting music"
"A_58","S_8","Stent, G. C.","Music","Arts and Archaeology","1868-1877",1,0.333333333333333,1871,1872,"Chinese lyrics"
"A_56","S_16","Smith, F. P.","Commerce","Economy, Trade, and Technology","1868-1877",1,0.25,1869,1870,"Chinese chemical manufactures"
"A_47","S_34","Simon, G. E.","Economics","Economy, Trade, and Technology","1868-1877",2,2,1868,1870,"Note sur les petites societes d'argent en Chine | Sur les Institutions de Cr<U+00E9>dit en Chine"
"A_56","S_15","Smith, F. P.","Industries","Economy, Trade, and Technology","1868-1877",1,0.25,1869,1870,"Chinese chemical manufactures"
"A_55","S_11","Moule, G. E.","Education","Education","1868-1877",1,1,1869,1870,"Notes on the provincial examination of Chekiang, 1870, with a version of one of the essays"
"A_72","S_37","Bretschneider, E.","Geography","Geography and Travel","1868-1877",1,0.25,1876,1876,"Notices of the mediaeval geography and history of Central and Western Asia *"
"A_53","S_37","Eitel, E. J.","Geography","Geography and Travel","1868-1877",1,0.333333333333333,1869,1870,"The Fabulous source of the Hoang-ho"
"A_70","S_37","Palladius, A.","Geography","Geography and Travel","1868-1877",1,1,1876,1876,"Elucidations of Marco Polo's travels in North China, drawn from Chinese sources"
"A_1","S_39","Edkins, J.","Navigation","Geography and Travel","1868-1877",1,0.5,1877,1877,"On Chinese names for boats and boat gear with remarks on the Chinese use of the mariner's compass"
"A_1","S_6","Edkins, J.","Travel","Geography and Travel","1868-1877",1,0.5,1874,1874,"Visit to the city of Confucius, A"
"A_71","S_6","Holcombe, C.","Travel","Geography and Travel","1868-1877",1,1,1876,1876,"Notes made on a tour through Shan - hsi and Shen - hsi"
"A_52","S_6","Markham, J.","Travel","Geography and Travel","1868-1877",1,1,1869,1870,"Notes on the Shantung Province, being a journey from Chefoo to Tsiuhsien, the city of Mencius"
"A_12","S_6","Swinhoe, R.","Travel","Geography and Travel","1868-1877",1,1,1871,1872,"Narrative of an exploring visit to Hainan"
"A_11","S_6","Williams, S. W.","Travel","Geography and Travel","1868-1877",1,0.5,1869,1870,"Journal of a mission to Lewchew in 1801"
"A_2","S_6","Wylie, A.","Travel","Geography and Travel","1868-1877",1,1,1868,1868,"Itinerary of a jouney through the Provinces of Hoo - pih, Sze - chuen and Shen - se"
"A_29","S_35","Kingsmill, T. W.","Biography","History and Chronology","1868-1877",1,1,1874,1874,"The legend of Wen Wang, founder of the dynasty of the Chows in China"
"A_51","S_35","Preston, C. F.","Biography","History and Chronology","1868-1877",1,1,1868,1868,"Lok Ping Chiung, late Governor General of Sze - chuen, Notices of"
"A_72","S_30","Bretschneider, E.","History","History and Chronology","1868-1877",1,0.25,1876,1876,"Notices of the mediaeval geography and history of Central and Western Asia *"
"A_74","S_30","Hobson, H. E.","History","History and Chronology","1868-1877",1,1,1877,1877,"Fort Zelandia, and the Dutch occupation of Formosa"
"A_29","S_30","Kingsmill, T. W.","History","History and Chronology","1868-1877",1,1,1871,1872,"The Mythical origin of the Chow or Djow Dynasty, as set forth in the ""Shoo-king"""
"A_45","S_30","Mayers, W. F.","History","History and Chronology","1868-1877",1,1,1871,1872,"A Historical and statistical sketch of the island of Hainan"
"A_63","S_30","Schmidt, C.","History","History and Chronology","1868-1877",1,1,1874,1874,"Extracts from the history of Shanghai"
"A_11","S_30","Williams, S. W.","History","History and Chronology","1868-1877",1,0.5,1869,1870,"Journal of a mission to Lewchew in 1801"
"A_69","S_18","Cordier, H.","History, Modern (20th century)","History and Chronology","1868-1877",1,1,1875,1875,"Narrative of recent events in Tong - king"
"A_17","S_18","Editorial Committee","History, Modern (20th century)","History and Chronology","1868-1877",3,3,1868,1874,"Retrospect of events in China and Japan, 1868 | Retrospect of events in China, etc., 1871, 1872 | Retrospect of events in China, 1873"
"A_73","S_18","Little, A. J.","History, Modern (20th century)","History and Chronology","1868-1877",1,1,1876,1876,"Retrospect of events in China, 1875"
"A_64","S_18","Viguier, S. A.","History, Modern (20th century)","History and Chronology","1868-1877",1,1,1874,1874,"Brief account of the French Expedition of 1866 into Indo - China"
"A_11","S_18","Williams, S. W.","History, Modern (20th century)","History and Chronology","1868-1877",1,1,1874,1874,"Recollections of China prior to 1840"
"A_3","S_7","Macgowan, D. J.","Language and languages","Literature and Language","1868-1877",1,1,1871,1872,"Chinese use of shad in consumption and iodine Plants in scrofula"
"A_36","S_7","Martin, W. A. P.","Language and languages","Literature and Language","1868-1877",1,1,1877,1877,"On the Styles of Chinese epistolary composition"
"A_55","S_7","Moule, G. E.","Language and languages","Literature and Language","1868-1877",1,1,1875,1875,"Notes on Col. Yule's edition of Marco Polo's "" Quinsay "" *"
"A_58","S_7","Stent, G. C.","Language and languages","Literature and Language","1868-1877",2,1.33333333333333,1871,1872,"Chinese lyrics | Chinese legends"
"A_12","S_7","Swinhoe, R.","Language and languages","Literature and Language","1868-1877",1,0.25,1871,1872,"The Aborigines of Hainan"
"A_48","S_7","Watters, T.","Language and languages","Literature and Language","1868-1877",1,1,1871,1872,"The Life and works of Han Yu or Han Wen-Kung"
"A_58","S_33","Stent, G. C.","Literature","Literature and Language","1868-1877",1,0.333333333333333,1871,1872,"Chinese lyrics"
"A_12","S_33","Swinhoe, R.","Literature","Literature and Language","1868-1877",1,0.25,1871,1872,"The Aborigines of Hainan"
"A_45","S_38","Mayers, W. F.","Military art and science","Military","1868-1877",1,1,1869,1870,"On the Introduction and use of gunpower and firearms among the Chinese, with notes on some ancient engines of warfare"
"A_56","S_14","Smith, F. P.","Agriculture","Natural Sciences","1868-1877",1,0.25,1869,1870,"Chinese chemical manufactures"
"A_60","S_19","David, Le P. A.","Botany","Natural Sciences","1868-1877",1,0.333333333333333,1871,1872,"Quelques renseignments sur l'histoire naturelle de la Chine septentrionale et occidentale"
"A_56","S_26","Smith, F. P.","Chemistry","Natural Sciences","1868-1877",1,0.25,1869,1870,"Chinese chemical manufactures"
"A_41","S_20","Bickmore, A. S.","Geology","Natural Sciences","1868-1877",1,1,1868,1868,"Some remarks on recent elevations of land in China and Japan"
"A_60","S_20","David, Le P. A.","Geology","Natural Sciences","1868-1877",1,0.333333333333333,1871,1872,"Quelques renseignments sur l'histoire naturelle de la Chine septentrionale et occidentale"
"A_29","S_20","Kingsmill, T. W.","Geology","Natural Sciences","1868-1877",2,1.25,1868,1877,"Notes on the coal fields and general geology of the neighbourhood of Nagasaki * | The Borderlands of geology and history"
"A_47","S_20","Simon, G. E.","Geology","Natural Sciences","1868-1877",1,0.5,1868,1868,"Note sur quelques unes des recherches que l'on pourrait faire en Chine at au Japon au point de vue de la geologie et de la paleontologie"
"A_53","S_10","Eitel, E. J.","Hydrology","Natural Sciences","1868-1877",1,0.333333333333333,1869,1870,"The Fabulous source of the Hoang-ho"
"A_44","S_10","Ellias, N.","Hydrology","Natural Sciences","1868-1877",1,1,1868,1868,"Report of an exploration of the new course of the Yellow River"
"A_3","S_22","Macgowan, D. J.","Medicine","Natural Sciences","1868-1877",2,2,1871,1875,"On the "" Mutton wine "" of the Mongols and analagous preparations of the Chinese | Notes on Chinese toxicology"
"A_1","S_5","Edkins, J.","Meteorology","Natural Sciences","1868-1877",1,0.5,1877,1877,"On Chinese names for boats and boat gear with remarks on the Chinese use of the mariner's compass"
"A_61","S_5","Meteorological Committee","Meteorology","Natural Sciences","1868-1877",1,1,1871,1872,"Meteorological observations, April - December 1872"
