"from","to","author","subject_l2","subject_l1","time_window","article_count","weight","first_year","last_year","titles"
"A_193","S_24","Howell, E. B.","Archaeology","Arts and Archaeology","1918-1927",1,0.5,1919,1919,"Exhibition of pictures by a Russian artist, An *"
"A_181","S_24","Hutson J.","Archaeology","Arts and Archaeology","1918-1927",3,1,1920,1923,"Chinese ideas of antiques | Shuh country, The | The Shuh country"
"A_148","S_24","Stanley, A.","Archaeology","Arts and Archaeology","1918-1927",1,0.5,1920,1920,"Greek and Chinese art ideals"
"A_231","S_45","Abraham, R. D.","Art","Arts and Archaeology","1918-1927",1,1,1927,1927,"Motives of Chinese art, The"
"A_133","S_45","Ferguson, J. C.","Art","Arts and Archaeology","1918-1927",1,0.5,1923,1923,"Culture, the basis of Chinese art"
"A_193","S_45","Howell, E. B.","Art","Arts and Archaeology","1918-1927",1,0.5,1919,1919,"Exhibition of pictures by a Russian artist, An *"
"A_181","S_45","Hutson J.","Art","Arts and Archaeology","1918-1927",3,1,1920,1923,"Chinese ideas of antiques | Shuh country, The | The Shuh country"
"A_148","S_45","Stanley, A.","Art","Arts and Archaeology","1918-1927",1,0.5,1920,1920,"Greek and Chinese art ideals"
"A_133","S_47","Ferguson, J. C.","Painting","Arts and Archaeology","1918-1927",1,1,1918,1918,"Ku K'ai - chih's scroll in the British Museum *"
"A_188","S_16","Yan Taz Chiu","Commerce","Economy, Trade, and Technology","1918-1927",1,0.25,1919,1919,"Chemical industry in Kwangtung Province"
"A_171","S_34","Ayscough, F. W.","Economics","Economy, Trade, and Technology","1918-1927",1,0.25,1921,1921,"Notes on the symbolism of the Purple Forbidden City *"
"A_188","S_15","Yan Taz Chiu","Industries","Economy, Trade, and Technology","1918-1927",1,0.25,1919,1919,"Chemical industry in Kwangtung Province"
"A_157","S_52","Edgar, J. H.","Asia","Geography and Travel","1918-1927",1,0.333333333333333,1926,1926,"Tibetan and his environment : an interpretation, The"
"A_133","S_52","Ferguson, J. C.","Asia","Geography and Travel","1918-1927",1,0.5,1926,1926,"General survey of standard Chinese histories"
"A_77","S_52","Hosie, A.","Asia","Geography and Travel","1918-1927",1,0.333333333333333,1926,1926,"Map of China in the making, A"
"A_220","S_52","MacNair, H. F.","Asia","Geography and Travel","1918-1927",1,0.5,1925,1925,"Some observation on China's international relations"
"A_139","S_52","Moule, A. C.","Asia","Geography and Travel","1918-1927",1,0.5,1927,1927,"Siege of Saianfu and the murder of Achmach Bailo, The"
"A_144","S_52","Torrance, T.","Asia","Geography and Travel","1918-1927",1,0.333333333333333,1924,1924,"History of Shuh a free translation of the Shuh Chi"
"A_199","S_52","Werner, E. T. C.","Asia","Geography and Travel","1918-1927",1,0.333333333333333,1925,1925,"Burial place of Genghis Kwan, The"
"A_157","S_37","Edgar, J. H.","Geography","Geography and Travel","1918-1927",1,0.333333333333333,1926,1926,"Tibetan and his environment : an interpretation, The"
"A_77","S_37","Hosie, A.","Geography","Geography and Travel","1918-1927",1,0.333333333333333,1926,1926,"Map of China in the making, A"
"A_109","S_37","Morse, H. B.","Geography","Geography and Travel","1918-1927",1,1,1921,1921,"Lampacao, a mystery of the Far East"
"A_144","S_37","Torrance, T.","Geography","Geography and Travel","1918-1927",1,0.333333333333333,1924,1924,"History of Shuh a free translation of the Shuh Chi"
"A_199","S_37","Werner, E. T. C.","Geography","Geography and Travel","1918-1927",1,0.333333333333333,1925,1925,"Burial place of Genghis Kwan, The"
"A_171","S_6","Ayscough, F. W.","Travel","Geography and Travel","1918-1927",2,1.25,1921,1923,"Notes on the symbolism of the Purple Forbidden City * | Preliminary notes on the literary background of the "" Great River """
"A_157","S_6","Edgar, J. H.","Travel","Geography and Travel","1918-1927",1,0.333333333333333,1926,1926,"Tibetan and his environment : an interpretation, The"
"A_184","S_6","Edmunds, C. K.","Travel","Geography and Travel","1918-1927",1,1,1919,1919,"Thirty thousand miles in China *"
"A_213","S_6","Fischer, E. S.","Travel","Geography and Travel","1918-1927",1,1,1923,1923,"Modern travel from Tai Yuan Fu via Mount Wu Tai to the Mongolian frontier"
"A_77","S_6","Hosie, A.","Travel","Geography and Travel","1918-1927",1,0.333333333333333,1926,1926,"Map of China in the making, A"
"A_198","S_6","Kemp, E. G.","Travel","Geography and Travel","1918-1927",1,0.333333333333333,1921,1921,"Highways and byways of Kweichow, The *"
"A_192","S_6","King, G. E.","Travel","Geography and Travel","1918-1927",1,1,1919,1919,"Notes on Kansu"
"A_144","S_6","Torrance, T.","Travel","Geography and Travel","1918-1927",1,0.333333333333333,1924,1924,"History of Shuh a free translation of the Shuh Chi"
"A_199","S_6","Werner, E. T. C.","Travel","Geography and Travel","1918-1927",1,0.333333333333333,1925,1925,"Burial place of Genghis Kwan, The"
"A_214","S_35","Darroch, J.","Biography","History and Chronology","1918-1927",1,1,1923,1923,"A page of ancient Chinese history"
"A_230","S_35","Leung, G. K.","Biography","History and Chronology","1918-1927",1,0.5,1927,1927,"Mei Lan - Fang (the man and his art)"
"A_183","S_35","Morgan, E.","Biography","History and Chronology","1918-1927",1,1,1927,1927,"Chou - kung ; The Duke of Chou"
"A_228","S_35","Teesdale, J. H.","Biography","History and Chronology","1918-1927",1,1,1926,1926,"Li Sin Cheng, the Chung Wang or "" Faithful Prince """
"A_194","S_30","Dodd, W. C.","History","History and Chronology","1918-1927",1,0.333333333333333,1920,1920,"Relation of Chinese and Siamese, The *"
"A_181","S_30","Hutson J.","History","History and Chronology","1918-1927",2,0.5,1922,1923,"Shuh country, The | The Shuh country"
"A_173","S_30","Lanning, G.","History","History and Chronology","1918-1927",1,1,1920,1920,"Names and nicknames of the Shanghai settlements"
"A_183","S_56","Morgan, E.","History, Ancient","History and Chronology","1918-1927",1,1,1926,1926,"League of nations in ancient China"
"A_133","S_55","Ferguson, J. C.","History, Modern","History and Chronology","1918-1927",1,0.5,1926,1926,"General survey of standard Chinese histories"
"A_220","S_55","MacNair, H. F.","History, Modern","History and Chronology","1918-1927",1,0.5,1925,1925,"Some observation on China's international relations"
"A_139","S_55","Moule, A. C.","History, Modern","History and Chronology","1918-1927",1,0.5,1927,1927,"Siege of Saianfu and the murder of Achmach Bailo, The"
"A_225","S_54","Gillis, I. V.","East Asian languages","Literature and Language","1918-1927",1,1,1925,1925,"Critical review of Chalfant's notes upon the "" Shuo Wen """
"A_216","S_54","Shirokogoroff, S. M.","East Asian languages","Literature and Language","1918-1927",1,1,1924,1924,"Critical bibliographical notes : study of the Tungus languages"
"A_171","S_7","Ayscough, F. W.","Language and languages","Literature and Language","1918-1927",1,1,1920,1920,"Chinese poetry and its connotations *"
"A_210","S_7","Budd, C.","Language and languages","Literature and Language","1918-1927",1,1,1923,1923,"Snowstorm, A"
"A_133","S_7","Ferguson, J. C.","Language and languages","Literature and Language","1918-1927",2,2,1919,1922,"Recent books by a Chinese scholar | "" Fir - flower Tablets """
"A_200","S_7","Fletcher, W. J. B.","Language and languages","Literature and Language","1918-1927",2,2,1921,1921,"Trip to Hua Kang, A | Song of a skirt, The"
"A_203","S_7","Gaunt, T.","Language and languages","Literature and Language","1918-1927",1,1,1922,1922,"Ling Yin monastery poem"
"A_202","S_7","Hudson, E.","Language and languages","Literature and Language","1918-1927",4,4,1922,1923,"Lan - tsih * | Drought, The | Then and now | Night in the mountains, A"
"A_211","S_7","Jamieson, C. A.","Language and languages","Literature and Language","1918-1927",1,1,1923,1923,"Chu - goh Leang and the arrows"
"A_187","S_7","Kliene, C.","Language and languages","Literature and Language","1918-1927",2,2,1919,1921,"Land of Peach Bloom, The | Marriage maker, The"
"A_185","S_7","Williams, C. A. S.","Language and languages","Literature and Language","1918-1927",1,1,1919,1919,"Chinese metaphorical zoology"
"A_133","S_33","Ferguson, J. C.","Literature","Literature and Language","1918-1927",1,1,1925,1925,"Stories in Chinese paintings, I"
"A_202","S_33","Hudson, E.","Literature","Literature and Language","1918-1927",1,1,1927,1927,"Little Lu - fu, and looking at a painting by Wang - tzu"
"A_230","S_33","Leung, G. K.","Literature","Literature and Language","1918-1927",1,0.5,1927,1927,"Mei Lan - Fang (the man and his art)"
"A_221","S_33","Sheppard, G. W. (ed.)","Literature","Literature and Language","1918-1927",1,1,1925,1925,"Edict of Ch ' in Shih Huang, A"
"A_186","S_14","Skvortzow, B. W.","Agriculture","Natural Sciences","1918-1927",4,1.33333333333333,1919,1922,"Notes on the agriculture, botany and the zoology of China, Sections i - xxxii * | Notes on the agriculture, botany and the zoology of China, Sections xxxiii- xxxviii * | Notes on the agriculture, botany and the zoology of China, Sections xxxix - xlvi * | Notes on the agriculture, botany and the zoology of China, Sections xlvii - xlix *"
"A_144","S_14","Torrance, T.","Agriculture","Natural Sciences","1918-1927",1,1,1924,1924,"Origin and history of the irrigation work of the Chengtu Plain"
"A_188","S_14","Yan Taz Chiu","Agriculture","Natural Sciences","1918-1927",1,0.25,1919,1919,"Chemical industry in Kwangtung Province"
"A_208","S_19","Cowdry, N. H.","Botany","Natural Sciences","1918-1927",1,1,1922,1922,"Plants from Peitaiho"
"A_191","S_19","Gee, N. G.","Botany","Natural Sciences","1918-1927",1,0.5,1919,1919,"Beginning of the study of the flora and fauna of Soochow and vicinity, A"
"A_205","S_19","Hers, J.","Botany","Natural Sciences","1918-1927",1,1,1922,1922,"Chinese names of plants ; a preliminary list of the trees and shrubs of North Honan"
"A_186","S_19","Skvortzow, B. W.","Botany","Natural Sciences","1918-1927",4,1.33333333333333,1919,1922,"Notes on the agriculture, botany and the zoology of China, Sections i - xxxii * | Notes on the agriculture, botany and the zoology of China, Sections xxxiii- xxxviii * | Notes on the agriculture, botany and the zoology of China, Sections xxxix - xlvi * | Notes on the agriculture, botany and the zoology of China, Sections xlvii - xlix *"
"A_188","S_26","Yan Taz Chiu","Chemistry","Natural Sciences","1918-1927",1,0.25,1919,1919,"Chemical industry in Kwangtung Province"
"A_224","S_20","Barbour, G. B.","Geology","Natural Sciences","1918-1927",1,1,1925,1925,"Springs of Tsinanfu, The"
"A_170","S_20","Chatley, H.","Geology","Natural Sciences","1918-1927",1,1,1920,1920,"China's petrified sun - rays"
"A_201","S_20","Heidenstem","Geology","Natural Sciences","1918-1927",1,0.5,1922,1922,"Growth of the Yangtze delta, The *"
"A_204","S_20","Norin, E.","Geology","Natural Sciences","1918-1927",1,1,1922,1922,"Notes on the coal and Iron Ore deposits of Central Shansi"
"A_226","S_20","Turner, F. B.","Geology","Natural Sciences","1918-1927",1,1,1926,1926,"Flood and famine in North China"
"A_170","S_10","Chatley, H.","Hydrology","Natural Sciences","1918-1927",1,1,1918,1918,"River problems in China *"
"A_201","S_10","Heidenstem","Hydrology","Natural Sciences","1918-1927",1,0.5,1922,1922,"Growth of the Yangtze delta, The *"
"A_191","S_12","Gee, N. G.","Zoology","Natural Sciences","1918-1927",2,1.5,1919,1926,"Beginning of the study of the flora and fauna of Soochow and vicinity, A | Chinese fresh water sponges"
"A_206","S_12","Jacot, A. P.","Zoology","Natural Sciences","1918-1927",5,5,1922,1927,"Oribatoidae Sinensis, Part I | Oribatoidae Sinensis, Part II | Oribatoidea Sinensis, Part III | Shantung foraminifera | Genus gueldenstaedtia (leguminoseae), The"
"A_189","S_12","Kellogg, C. R.","Zoology","Natural Sciences","1918-1927",1,1,1919,1919,"List of the birds in the Museum of the Anglo - Chinese College of Foochow, China"
"A_172","S_12","Laver, H. E.","Zoology","Natural Sciences","1918-1927",1,1,1918,1918,"Some notes on land - birds, including also general remarks on the birds observed at sea on the coast of China in 1916"
"A_190","S_12","Moore, A.","Zoology","Natural Sciences","1918-1927",1,1,1919,1919,"Attractions of entomology, The"
"A_209","S_12","Riley, J. H. and Richmond, C. W.","Zoology","Natural Sciences","1918-1927",2,2,1922,1922,"Partial bibliography of Chinese birds, A | Partial bibliography of Chinese birds, A (complementary to the List given in Vol 53, pp. 196-237)"
"A_207","S_12","Sjolander, D.","Zoology","Natural Sciences","1918-1927",1,1,1922,1922,"Distribution and habits of the Argali sheep of Central Asia, The *"
"A_186","S_12","Skvortzow, B. W.","Zoology","Natural Sciences","1918-1927",4,1.33333333333333,1919,1922,"Notes on the agriculture, botany and the zoology of China, Sections i - xxxii * | Notes on the agriculture, botany and the zoology of China, Sections xxxiii- xxxviii * | Notes on the agriculture, botany and the zoology of China, Sections xxxix - xlvi * | Notes on the agriculture, botany and the zoology of China, Sections xlvii - xlix *"
"A_166","S_12","Sowerby, A. de C.","Zoology","Natural Sciences","1918-1927",1,1,1922,1922,"Natural history of China, The"
"A_144","S_12","Torrance, T.","Zoology","Natural Sciences","1918-1927",1,1,1926,1926,"Chinese cat, The"
"A_219","S_12","Wilder, G. D. and Hubbard, H. W.","Zoology","Natural Sciences","1918-1927",2,2,1924,1926,"List of the birds of Chihli Province | Corrections and additions to the list of the birds of Chihli Province"
"A_171","S_40","Ayscough, F. W.","Government","Politics, Government, and Law","1918-1927",1,0.25,1921,1921,"Notes on the symbolism of the Purple Forbidden City *"
"A_133","S_44","Ferguson, J. C.","Political science","Politics, Government, and Law","1918-1927",1,1,1927,1927,"Political parties of the Northern Sung Dynasty"
"A_171","S_41","Ayscough, F. W.","Political science--Philosophy","Politics, Government, and Law","1918-1927",1,0.25,1921,1921,"Notes on the symbolism of the Purple Forbidden City *"
"A_212","S_1","Stael - Holstein, Baron A. von","Buddhism","Religion and Philosophy","1918-1927",1,1,1923,1923,"Hsuan - tsang and modern research"
"A_171","S_53","Ayscough, F. W.","China--Religion","Religion and Philosophy","1918-1927",1,0.5,1924,1924,"Cult of the Ch'eng Huang Lao Yeh"
"A_233","S_53","Couling, C. E.","China--Religion","Religion and Philosophy","1918-1927",1,1,1927,1927,"Partriarch Lu, The"
"A_223","S_53","Dovey, J. W.","China--Religion","Religion and Philosophy","1918-1927",1,1,1925,1925,"Life and times of Confucius, The"
"A_217","S_53","Hayes, L. N.","China--Religion","Religion and Philosophy","1918-1927",1,1,1924,1924,"Gods of the Chinese, The"
"A_199","S_53","Werner, E. T. C.","China--Religion","Religion and Philosophy","1918-1927",1,1,1925,1925,"Rebuttal notes on chinese religion and dynastic tombs"
"A_215","S_23","Heeren, J. J.","Christianity","Religion and Philosophy","1918-1927",1,1,1923,1923,"Bishop Della Chiesa and the story of his lost grave *"
"A_199","S_23","Werner, E. T. C.","Christianity","Religion and Philosophy","1918-1927",2,2,1921,1922,"Christ in the "" Li Tai Shen Hsien T'ung Chien "" | Christ in the "" Li Tai Shen Hsien Tung Chien "" *"
"A_195","S_50","Mason, I.","Islam","Religion and Philosophy","1918-1927",2,2,1920,1925,"Chinese life of Mohammed, A | Notes on Chinese Mohammedan Literature"
"A_177","S_50","Zwemer, S. M.","Islam","Religion and Philosophy","1918-1927",1,1,1918,1918,"Animistic elements in Moslem prayer"
"A_182","S_9","Bruce, J. P.","Philosophy","Religion and Philosophy","1918-1927",1,1,1918,1918,"Theistic import of the Sung philosophy, The"
"A_227","S_9","Freeman, M.","Philosophy","Religion and Philosophy","1918-1927",1,1,1926,1926,"Yen Hsi Chai, a 17th century philosopher"
"A_183","S_9","Morgan, E.","Philosophy","Religion and Philosophy","1918-1927",1,1,1920,1920,"Destiny, fate"
"A_222","S_9","Pott, F. L. H.","Philosophy","Religion and Philosophy","1918-1927",1,1,1925,1925,"Teaching of Micius, The"
"A_147","S_9","Warren, G. G.","Philosophy","Religion and Philosophy","1918-1927",1,1,1924,1924,"Was Chu Hsi a materialist ?"
"A_157","S_36","Edgar, J. H.","Religion","Religion and Philosophy","1918-1927",1,1,1922,1922,"Note on Chiang sacrifice and litholatry"
"A_229","S_36","G. S. S. G.","Religion","Religion and Philosophy","1918-1927",1,0.333333333333333,1926,1926,"Some notes on the remains of a phallic shrine in Japan"
"A_215","S_36","Heeren, J. J.","Religion","Religion and Philosophy","1918-1927",1,0.5,1925,1925,"Some new light on the life and times of Bishop Della Chiesa"
"A_181","S_36","Hutson J.","Religion","Religion and Philosophy","1918-1927",1,1,1918,1918,"Domestic altar, The"
"A_183","S_36","Morgan, E.","Religion","Religion and Philosophy","1918-1927",1,1,1918,1918,"Case of ritualism, A"
"A_216","S_36","Shirokogoroff, S. M.","Religion","Religion and Philosophy","1918-1927",1,1,1923,1923,"General theory of shamanism among the Tungus"
"A_144","S_36","Torrance, T.","Religion","Religion and Philosophy","1918-1927",1,1,1923,1923,"Religion of the Ch'iang, The *"
"A_199","S_36","Werner, E. T. C.","Religion","Religion and Philosophy","1918-1927",1,1,1923,1923,"Chinese composite deities"
"A_178","S_43","Ling, P. C.","Taoism","Religion and Philosophy","1918-1927",1,1,1918,1918,"Eight Immortals of the Taoist religion, The"
"A_183","S_43","Morgan, E.","Taoism","Religion and Philosophy","1918-1927",2,2,1921,1923,"Operations and manifestations of the Tao exemplified in history, The | Taoist superman, The"
"A_170","S_4","Chatley, H.","Anthropology","Anthropology and Social Customs","1928-1932",1,0.5,1929,1929,"Did ancient Chinese culture come from Egypt ?"
"A_259","S_4","Gapanovich, J. J.","Anthropology","Anthropology and Social Customs","1928-1932",1,0.5,1931,1931,"Asiatic origin of South American man, The"
"A_170","S_3","Chatley, H.","Ethnology","Anthropology and Social Customs","1928-1932",1,0.5,1929,1929,"Did ancient Chinese culture come from Egypt ?"
"A_259","S_3","Gapanovich, J. J.","Ethnology","Anthropology and Social Customs","1928-1932",1,0.5,1931,1931,"Asiatic origin of South American man, The"
"A_235","S_51","Wang Kuo Wei","Folklore","Anthropology and Social Customs","1928-1932",1,1,1928,1928,"Chinese foot measures of the past nineteen centuries"
"A_239","S_17","White, L. M.","Mythology","Anthropology and Social Customs","1928-1932",1,0.5,1928,1928,"Early Christianity in Japan"
"A_183","S_45","Morgan, E.","Art","Arts and Archaeology","1928-1932",1,1,1929,1929,"The George Eumorfopoulos collection : catalogue of the Chinese and Corean bronzes, sculpture, jades, jewellery and miscellaneous objects : by W. Percival Yetts, A"
"A_237","S_8","Phelps, D. L.","Music","Arts and Archaeology","1928-1932",1,0.5,1928,1928,"Place of Music in the Platonic and Confucian systems of moral education, The"
"A_231","S_42","Abraham, R. D.","Porcelain","Arts and Archaeology","1928-1932",1,1,1931,1931,"Chinese pottery and porcelain : an appreciation"
"A_133","S_42","Ferguson, J. C.","Porcelain","Arts and Archaeology","1928-1932",1,1,1928,1928,"Shapes of porcelain vessels"
"A_243","S_34","Kann, E.","Economics","Economy, Trade, and Technology","1928-1932",1,1,1929,1929,"Gold in China : in its historical, practical and financial aspects"
"A_237","S_11","Phelps, D. L.","Education","Education","1928-1932",1,0.5,1928,1928,"Place of Music in the Platonic and Confucian systems of moral education, The"
"A_171","S_52","Ayscough, F. W.","Asia","Geography and Travel","1928-1932",1,0.333333333333333,1930,1930,"Symbolism of the Forbidden City, Peking, The *"
"A_242","S_52","Chang Hsin - hai","Asia","Geography and Travel","1928-1932",1,0.5,1929,1929,"Some types of Chinese historical thought"
"A_213","S_52","Fischer, E. S.","Asia","Geography and Travel","1928-1932",1,0.333333333333333,1930,1930,"Journey to the Tung Ling and a visit to the desecrated Eastern Mausolea of the Ta Tsing dynasty, in 1929, A"
"A_255","S_52","Haward, E.","Asia","Geography and Travel","1928-1932",1,0.25,1931,1931,"Indian frontier, The"
"A_217","S_52","Hayes, L. N.","Asia","Geography and Travel","1928-1932",1,0.333333333333333,1928,1928,"The Great Wall of China"
"A_234","S_52","MacGillivray, D.","Asia","Geography and Travel","1928-1932",1,0.333333333333333,1928,1928,"Jews of Honan, The"
"A_139","S_52","Moule, A. C.","Asia","Geography and Travel","1928-1932",1,0.5,1928,1928,"Murder of Achmach Bailo, The"
"A_171","S_37","Ayscough, F. W.","Geography","Geography and Travel","1928-1932",1,0.333333333333333,1930,1930,"Symbolism of the Forbidden City, Peking, The *"
"A_213","S_37","Fischer, E. S.","Geography","Geography and Travel","1928-1932",1,0.333333333333333,1930,1930,"Journey to the Tung Ling and a visit to the desecrated Eastern Mausolea of the Ta Tsing dynasty, in 1929, A"
"A_255","S_37","Haward, E.","Geography","Geography and Travel","1928-1932",1,0.25,1931,1931,"Indian frontier, The"
"A_217","S_37","Hayes, L. N.","Geography","Geography and Travel","1928-1932",1,0.333333333333333,1928,1928,"The Great Wall of China"
"A_234","S_37","MacGillivray, D.","Geography","Geography and Travel","1928-1932",1,0.333333333333333,1928,1928,"Jews of Honan, The"
"A_171","S_6","Ayscough, F. W.","Travel","Geography and Travel","1928-1932",1,0.333333333333333,1930,1930,"Symbolism of the Forbidden City, Peking, The *"
"A_213","S_6","Fischer, E. S.","Travel","Geography and Travel","1928-1932",1,0.333333333333333,1930,1930,"Journey to the Tung Ling and a visit to the desecrated Eastern Mausolea of the Ta Tsing dynasty, in 1929, A"
"A_255","S_6","Haward, E.","Travel","Geography and Travel","1928-1932",1,0.25,1931,1931,"Indian frontier, The"
"A_217","S_6","Hayes, L. N.","Travel","Geography and Travel","1928-1932",1,0.333333333333333,1928,1928,"The Great Wall of China"
"A_234","S_6","MacGillivray, D.","Travel","Geography and Travel","1928-1932",1,0.333333333333333,1928,1928,"Jews of Honan, The"
"A_241","S_35","Biallas, F. X.","Biography","History and Chronology","1928-1932",1,0.5,1928,1928,"K'u Yuan, his life and poems"
"A_240","S_35","Hu Shih","Biography","History and Chronology","1928-1932",1,1,1928,1928,"Wang Mang, the socialist emperor of nineteen centuries ago"
"A_170","S_32","Chatley, H.","Chronology, Historical","History and Chronology","1928-1932",1,1,1931,1931,"History of the days of the week, The"
"A_195","S_32","Mason, I.","Chronology, Historical","History and Chronology","1928-1932",1,0.5,1931,1931,"Chinese - Moslem chronology"
"A_245","S_56","Buxton, D.","History, Ancient","History and Chronology","1928-1932",1,1,1930,1930,"Light thrown on ancient Chinese history by recent archaeological discoveries, The *"
"A_248","S_56","Soothill, W. E.","History, Ancient","History and Chronology","1928-1932",1,1,1930,1930,"Kingship in China *"
"A_242","S_55","Chang Hsin - hai","History, Modern","History and Chronology","1928-1932",1,0.5,1929,1929,"Some types of Chinese historical thought"
"A_255","S_55","Haward, E.","History, Modern","History and Chronology","1928-1932",1,0.25,1931,1931,"Indian frontier, The"
"A_139","S_55","Moule, A. C.","History, Modern","History and Chronology","1928-1932",1,0.5,1928,1928,"Murder of Achmach Bailo, The"
"A_170","S_54","Chatley, H.","East Asian languages","Literature and Language","1928-1932",1,1,1930,1930,"Can Chinese writing be simplified ?"
"A_257","S_54","Gardner, C. S.","East Asian languages","Literature and Language","1928-1932",1,1,1931,1931,"Western transcription of Chinese, The"
"A_250","S_54","Hauer, Erich","East Asian languages","Literature and Language","1928-1932",1,1,1930,1930,"Why the sinologue should study manchu ?"
"A_183","S_54","Morgan, E.","East Asian languages","Literature and Language","1928-1932",1,1,1930,1930,"Language and new thought, or new words for new ideas"
"A_241","S_33","Biallas, F. X.","Literature","Literature and Language","1928-1932",1,0.5,1928,1928,"K'u Yuan, his life and poems"
"A_210","S_33","Budd, C.","Literature","Literature and Language","1928-1932",1,1,1930,1930,"Chinese poems"
"A_133","S_33","Ferguson, J. C.","Literature","Literature and Language","1928-1932",1,1,1930,1930,"Stories in Chinese painting, II"
"A_202","S_33","Hudson, E.","Literature","Literature and Language","1928-1932",1,1,1928,1928,"Kite's message, The"
"A_236","S_33","Meerkerk, M. E. R. F.","Literature","Literature and Language","1928-1932",1,1,1928,1928,"A German translation of the Hsi Hsiang Chi, A review"
"A_252","S_29","Coching Chu","Astronomy","Natural Sciences","1928-1932",1,1,1931,1931,"Climatic changes during historic time in China"
"A_206","S_19","Jacot, A. P.","Botany","Natural Sciences","1928-1932",3,3,1928,1931,"Contributions from the Herbarium of the Shantung Christian University"
"A_244","S_19","Liu, J. C.","Botany","Natural Sciences","1928-1932",1,1,1929,1929,"List of plant names included in the Cowdry Chihli flora, not recorded in the Index Florae Sinensis and its two supplements, A"
"A_253","S_19","Porterfield, W. M.","Botany","Natural Sciences","1928-1932",1,1,1931,1931,"Bamboos in China"
"A_238","S_20","Englaender, A. L.","Geology","Natural Sciences","1928-1932",2,2,1928,1929,"Origin and growth of deserts and the encroachment of the desert on North - China, The | Some notes on Aisa's Ice Age"
"A_251","S_22","Wu Lieh - teh","Medicine","Natural Sciences","1928-1932",1,1,1931,1931,"Early days of Western medicine in China"
"A_246","S_59","Vacca, G.","Science","Natural Sciences","1928-1932",1,1,1930,1930,"Some points on the history of science in China *"
"A_254","S_12","Ping, C.","Zoology","Natural Sciences","1928-1932",1,1,1931,1931,"Preliminary notes on the natural history of Nanking"
"A_195","S_58","Mason, I.","Associations, institutions, etc.","Politics, Government, and Law","1928-1932",1,1,1928,1928,"Three score years and ten"
